{
  "schema_version": 1,
  "skill": "meteor-methods",
  "description": "Representative method validation, authorization, async rate-limit version boundary, and client rejection cases.",
  "cases": [
    {
      "id": "method-authorization",
      "case_ref": "Case 1: missing check()",
      "mode": "workspace",
      "prompt": "Secure imports/api/reports/methods.js for Meteor 3. Validate the complete input, require authentication, prevent callers from choosing another owner, and keep the handler and Mongo operation asynchronous.",
      "meteor": {
        "release": "3.0+"
      },
      "fixture": "meteor-methods/method-authorization",
      "assertions": [
        {
          "id": "validates-complete-input",
          "text": "The method uses check to validate every accepted input field.",
          "evidence": "files"
        },
        {
          "id": "requires-user-id",
          "text": "The method rejects unauthenticated calls by checking this.userId.",
          "evidence": "files"
        },
        {
          "id": "derives-owner-server-side",
          "text": "The inserted owner identifier comes from this.userId instead of caller input.",
          "evidence": "files"
        },
        {
          "id": "uses-async-mongo",
          "text": "The async method awaits insertAsync or returns its Promise safely.",
          "evidence": "files"
        },
        {
          "id": "parses-as-javascript",
          "text": "The edited method module parses as JavaScript.",
          "evidence": "command",
          "command": "node --check imports/api/reports/methods.js"
        }
      ],
      "tags": ["representative", "failure"]
    },
    {
      "id": "async-rate-limit-matcher",
      "case_ref": "Case 6: async rate-limit matcher",
      "mode": "advisory",
      "prompt": "On Meteor 3.5, rate-limit reports.generate only for users whose Meteor.users subscription tier is not premium. Show the matcher and note its operational constraints and rejection behavior.",
      "meteor": {
        "release": "3.5+"
      },
      "assertions": [
        {
          "id": "uses-async-user-matcher",
          "text": "The userId matcher is async and queries with findOneAsync.",
          "evidence": "response"
        },
        {
          "id": "keeps-query-bounded",
          "text": "The user lookup is projected and kept fast because the message queue awaits it.",
          "evidence": "response"
        },
        {
          "id": "covers-rejected-promise",
          "text": "The answer calls for testing or handling a rejected matcher Promise.",
          "evidence": "response"
        }
      ],
      "tags": ["representative", "version"]
    },
    {
      "id": "matcher-before-3-5",
      "case_ref": "Case 7: async matcher before Meteor 3.5",
      "mode": "advisory",
      "prompt": "Our app is fixed on Meteor 3.4.1. Can a DDPRateLimiter matcher await Meteor.users.findOneAsync to decide a subscription-tier rule? Give a compatible path without assuming an upgrade.",
      "meteor": {
        "release": "3.4.1"
      },
      "assertions": [
        {
          "id": "states-3-5-floor",
          "text": "The answer states that async rate-limit matchers begin in Meteor 3.5.",
          "evidence": "response"
        },
        {
          "id": "keeps-3-4-sync",
          "text": "The Meteor 3.4.1 matcher remains synchronous.",
          "evidence": "response"
        },
        {
          "id": "offers-compatible-fallback",
          "text": "The answer offers a fixed rule, precomputed synchronous state, or an optional upgrade.",
          "evidence": "response"
        }
      ],
      "tags": ["boundary", "version"]
    },
    {
      "id": "local-call-async-rejection",
      "case_ref": "Case 8: local `callAsync` rejection shape",
      "mode": "advisory",
      "prompt": "A client method stub throws a native TypeError, then the catch block crashes while reading err.error. Are all callAsync rejections Meteor.Error, and how should this code distinguish intentional server errors safely?",
      "meteor": {
        "release": "3.0+"
      },
      "assertions": [
        {
          "id": "recognizes-other-errors",
          "text": "The answer recognizes native local, misuse, and transport error shapes.",
          "evidence": "response"
        },
        {
          "id": "narrows-caught-value",
          "text": "The caught value is narrowed before Meteor-specific fields are accessed.",
          "evidence": "response"
        },
        {
          "id": "preserves-meteor-error-contract",
          "text": "Intentional server-visible failures are still represented with Meteor.Error.",
          "evidence": "response"
        }
      ],
      "tags": ["failure", "regression"]
    }
  ]
}
