{
  "schema_version": 1,
  "skill": "migrate-to-meteor-3",
  "description": "Representative async propagation, synchronous boundaries, runtime context, React compatibility, and error-shape cases.",
  "cases": [
    {
      "id": "async-caller-chain",
      "case_ref": "Case 8: async propagation through callers",
      "mode": "workspace",
      "prompt": "Migrate imports/api/invoices.js to Meteor 3. Follow the complete caller chain instead of changing only the Mongo call. Preserve the method boundary and existing return shape.",
      "meteor": {
        "release": "3.0+"
      },
      "fixture": "migrate-to-meteor-3/async-caller-chain",
      "assertions": [
        {
          "id": "uses-find-one-async",
          "text": "The Mongo read uses findOneAsync instead of synchronous findOne.",
          "evidence": "files"
        },
        {
          "id": "awaits-before-property-access",
          "text": "The order Promise is resolved before code reads the total property.",
          "evidence": "files"
        },
        {
          "id": "propagates-through-callers",
          "text": "Promise handling propagates through calculateTotal and buildInvoice to the method boundary.",
          "evidence": "files"
        },
        {
          "id": "preserves-result-shape",
          "text": "The method still resolves to an invoice object with a total field.",
          "evidence": "files"
        }
      ],
      "tags": ["representative", "regression"]
    },
    {
      "id": "constructor-boundary",
      "case_ref": "Case 9: synchronous constructor boundary",
      "mode": "advisory",
      "prompt": "A Meteor 2 class constructor assigns Orders.findOne(orderId) to this.order. Explain and show how to migrate it to Meteor 3 while preserving correct construction.",
      "meteor": {
        "release": "3.0+"
      },
      "assertions": [
        {
          "id": "keeps-constructor-sync",
          "text": "The answer does not declare or describe an async JavaScript constructor.",
          "evidence": "response"
        },
        {
          "id": "moves-await-outside",
          "text": "The answer awaits findOneAsync in an async factory or before passing a preloaded order.",
          "evidence": "response"
        },
        {
          "id": "preserves-construction-contract",
          "text": "The resulting constructor receives resolved data and remains synchronous.",
          "evidence": "response"
        }
      ],
      "tags": ["boundary", "failure"]
    },
    {
      "id": "environment-variable-handler",
      "case_ref": "Case 21: async EnvironmentVariable wrapper",
      "mode": "advisory",
      "prompt": "A Meteor 2 package patches Meteor.publish by nesting EnvironmentVariable.withValue inside the invoked publication handler. After upgrading to Meteor 3, Meteor.userId publication context disappears across async work. Diagnose the interaction, provide the current Meteor 3 wrapper boundary, and describe regression verification before and after await.",
      "meteor": {
        "release": "3.0+"
      },
      "assertions": [
        {
          "id": "wraps-publish-call",
          "text": "EnvironmentVariable.withValue is placed at the patch wrapper's top level around the original publish.call.",
          "evidence": "response"
        },
        {
          "id": "avoids-handler-scope",
          "text": "The invoked publication handler calls the original function without introducing another withValue scope.",
          "evidence": "response"
        },
        {
          "id": "returns-wrapper-result",
          "text": "The wrapper returns the withValue result and the nested publish.call result.",
          "evidence": "response"
        },
        {
          "id": "checks-invocation-across-await",
          "text": "The proposed verification reads Meteor.userId or publication invocation context before and after an await.",
          "evidence": "response"
        }
      ],
      "tags": ["failure", "regression"]
    },
    {
      "id": "react-suspense-choice",
      "case_ref": "Case 24: React Suspense is optional",
      "mode": "advisory",
      "prompt": "During a Meteor 3 React migration, must every component replace classic meteor/react-meteor-data hooks with the /suspense import? Include the package-version checks and boundaries that control the choice.",
      "meteor": {
        "release": "3.0+",
        "packages": {
          "react-meteor-data": "inspect installed version"
        }
      },
      "assertions": [
        {
          "id": "keeps-classic-hooks-valid",
          "text": "The answer states that classic reactive hooks remain supported.",
          "evidence": "response"
        },
        {
          "id": "requires-suspense-boundary",
          "text": "The suspense path is conditional and requires an upstream Suspense boundary.",
          "evidence": "response"
        },
        {
          "id": "states-package-floors",
          "text": "The answer identifies Suspense support in react-meteor-data 2.7.0 and Meteor 3 compatibility in 3.0.0.",
          "evidence": "response"
        },
        {
          "id": "preserves-reactivity",
          "text": "The answer does not convert reactive client Minimongo reads to async reads by default.",
          "evidence": "response"
        }
      ],
      "tags": ["boundary", "version"]
    },
    {
      "id": "call-async-error-shape",
      "case_ref": "Case 26: non-Meteor `callAsync` rejection",
      "mode": "advisory",
      "prompt": "After migrating to callAsync, a client stub throws TypeError and the catch block crashes while reading error.error. Explain the possible rejection shapes and show safe narrowing without hiding intentional server failures.",
      "meteor": {
        "release": "3.0+"
      },
      "assertions": [
        {
          "id": "does-not-assume-meteor-error",
          "text": "The answer does not assume every local, misuse, or transport rejection is Meteor.Error.",
          "evidence": "response"
        },
        {
          "id": "narrows-before-fields",
          "text": "The caught value is narrowed before reading error, reason, or details fields.",
          "evidence": "response"
        },
        {
          "id": "keeps-intentional-meteor-errors",
          "text": "Intentional server-visible failures continue to use Meteor.Error.",
          "evidence": "response"
        }
      ],
      "tags": ["failure", "regression"]
    }
  ]
}
